Tytuł,Data publikacji,Liczba wyświetleń,Liczba polubień,Liczba komentarzy,Tagi filmu,Kategorie filmu,Channel_id,Długość filmu,Informacje o lokalizacji,Rodzaj filmu,video_id
Cash for Kim: North Korean Forced Laborers in Poland,2016-05-31T15:01:53Z,2520190,32115,5030,"['documentary', 'documentaries', 'interview', 'interviews', 'culture', 'wild', 'lifestyle', 'world', 'exclusive', 'independent', 'underground', 'videos', 'funny', 'funny videos', 'journalism', 'vice guide', 'vice presents', 'vice news', 'vbs.tv', 'vice.com', 'vice', 'vice magazine', 'vice mag', 'vice videos', 'NORTH KOREA', 'Poland', 'Exploitation of Labor']",24,UCn8zNIfYAQNdrFRrr8oibKw,PT32M42S,{},hd,SPjKs8NuY4s
Poland welcomes US troops,2017-01-15T15:36:17Z,161180,1299,401,"['CNN', 'News', 'CNN TV', 'CNN Newsroom', 'default']",25,UCupvZG-5ko_eiXAupbDfxWw,PT4M13S,{},hd,gcM0qFWkY0g
History of Poland,2021-06-18T09:17:46Z,20032,195,17,['History of Poland'],22,UCOFcY-c4QmypQxTkg9DkfeA,PT2H5M11S,{},hd,wa-48cYkJ3g
These Are 5 (More) Things THAT SURPRISED ME IN POLAND,2020-06-30T14:25:25Z,539150,23773,1403,[],22,UCAlZsyC0HuGx7AZI54edKzg,PT10M27S,"{'latitude': 51.5073509, 'longitude': -0.1277583, 'altitude': 0}",hd,7J7s7C4CMVw
How Is Poland Disrupting The European Union?,2016-01-24T19:00:02Z,340730,4959,3382,"['poland', 'europe', 'eu', 'poland ultra right group', 'european union', 'polish politics', 'eu politics', 'polish conservative government', 'law and justice party', 'eu vs poland', 'poland undemocratic principles', 'polish new parliament', 'poland crisis', 'central europe', 'ex communist nation', 'constitutional court', 'poland anti eu party', 'angela merkel', 'nazi', 'why is poland alarming the eu', 'adolf hitler', 'eu sanctions on poland', 'testtube', 'test tube', 'lissette padilla', 'News', 'current events']",25,UCgRvm1yLFoaQKhmaTqXk9SA,PT3M24S,{},hd,fUOuGQ5D-Rs
Pretty Radical: Inside Poland's Far Right - part one | Guardian Docs,2015-01-19T11:48:15Z,807274,7341,4721,"['pretty radical', 'nazi', 'nazism', 'far right', 'poland', 'polish', 'neo nazi', 'polish nazis', 'communist', 'national radical camp', 'fascist', 'fascism in poland', 'far right documentary', 'patriot', 'jewish', 'holocaust', 'auschwitz', 'skrajna prawica', 'anarchisci', 'ruchy faszyzujace', 'poland far right', 'far right poland', 'polish women', 'poland right wing', 'poland far right documentary', 'antisemitism', 'polish girls', 'based poland', 'racism in poland', 'jews', 'news', 'stepan bandera', 'azov', 'azov batallion', 'ukraine nazi', 'nazis ukraine']",25,UCHpw8xwDNhU9gdohEcJu4aA,PT8M56S,"{'latitude': 51.919438, 'longitude': 19.145136, 'altitude': 0}",hd,Ia5YkZfz-_4
History of Poland in countryballs,2018-07-15T16:00:00Z,1404070,24910,5200,"['poland', 'Polska', 'countryballs', 'animation', 'history of Poland', 'animacja', 'historia Polski', 'countryballe', 'historia Polski w countryballach', 'animacja o historii Polskii', 'animation about History of Poland', 'warsaw poland', 'Warsaw', '966', 'slav', 'slavs history', 'slavic tribes', 'WW2', 'interwar period', 'interwar', 'interwar poland', 'communist poland', 'Rzeczpospolita', 'Rzeczpospolita Obojga Narodów', 'PLC', 'husaria', 'hussars', 'sad', 'epic', 'war', 'sad history', 'nation', 'Napoleon', 'Napoleon Poland', 'Russian occupation Poland']",27,UCx22mlTERBqxg30j186hOsA,PT7M33S,{},hd,Avw3fBxlqoI
Pentagon gives update after missile hits Poland,2022-11-16T20:08:39Z,531888,7146,3572,"['latest news', 'Happening Now', 'CNN', 'Inside Politics', 'CNN Newsroom', 'Secretary of Defense', 'Lloyd Austin', 'Chairman of the Joint Chiefs of Staff', 'Mark Milley', 'Poland', 'Poland Missile Strike', 'Ukraine Missile Defense', 'Russia Ukraine War', ""Putin's War"", 'Ukraine Military', 'Russia Military', 'Eastern Europe', 'NATO', 'China', 'Taiwan', 'Ukraine Defense Contact Group', 'Ukraine Military Aid']",25,UCupvZG-5ko_eiXAupbDfxWw,PT47M22S,{},hd,m313YnbWU1U
"My First Day in Krakow, Poland 🇵🇱",2023-01-23T13:33:07Z,20479,1171,185,"['my first day in krakow poland', 'krakow', 'poland', 'krakow poland', 'krakow poland travel guide', 'things to do in krakow poland', 'travelwithchris poland', 'travelwithchris shorts', 'travelwithchris', 'krakow poland vlog', 'polish food', 'american in poland', 'krakow 2023', 'krakow vlogs', 'krakow travel vlog', 'krakow airport', 'krakow old town', 'krakow old town nightlife', 'krakow old town christmas market', 'krakow christmas market', 'krakow christmas market 2022', 'krakow christmas']",22,UC40tCi6qlNr-WS37JQSrSUQ,PT18M1S,"{'latitude': 50.0646501, 'longitude': 19.9449799, 'altitude': 0}",hd,prRUgNXcQDk
Krakow Poland Nativity Scenes Competition 2022 | Szopka Krakowska Christmas Tradition In Krakow,2022-12-01T18:56:34Z,10549,322,48,"['kraków nativity scenes contest', 'adam mickiewicz monument', 'christmas in krakow', 'christmas in poland', 'christmas traditions in krakow', 'christmas traditions in poland', 'first thursday of december', 'historical museum of kraków', 'krakow in december', 'krakow nativity scene', 'krakow poland nativity competition', 'krakow poland nativity contest', 'krakow poland nativity scene', 'krakow szopka', 'kraków szopka', 'main square krakow poland', 'polish christmas traditions', 'szopka', 'things to do in krakow']",19,UCL9QCO5vimeOw2VLh3xdWQw,PT33M57S,"{'latitude': 50.0646501, 'longitude': 19.9449799, 'altitude': 0}",hd,ekbZygMy2Gk
Bydgoszcz  - walking tour in 4K | Poland,2019-05-22T22:17:46Z,11318,141,9,"['bydgoszcz', 'poland', 'walkingtours', 'walkingtour', 'sightseeing', 'citysightseeing', 'hiking', 'cities', 'hikes', 'europe', 'dayhikes', 'tours', 'touring', 'tourism', 'treadmillwalk', 'operanova', 'brda', 'river', 'city', 'farnachurch', 'mostowastreet']",19,UChTbfkYOzZhuoa6ALdLGHyw,PT46M15S,"{'latitude': 53.1234804, 'longitude': 18.0084378, 'altitude': 0}",hd,MRrbWGfnIkE
Poland Indian History | Indian Maharaja Who Saved Polish | India Poland Trade | Indo Polish,2020-03-20T13:30:11Z,11252,508,125,"['india poland trade', 'poland indian history', 'poland india trade', 'indian maharaja who saved polish', 'poland india maharaja', 'poland india relations', 'poland refugees in india', 'poland refugees in jamnagar', 'india poland relations', 'indo polish', 'poland refugees in kolhapur', 'Poland history', 'poland refugees', 'poland refugees not welcome', 'poles in india', 'india in details', 'polish history', 'history of poland', 'sayali rahate', 'indians in poland', 'Poland india']",22,UCuTW-VCyv4a8B8aReF2_D-A,PT5M21S,"{'latitude': 52.2296756, 'longitude': 21.0122287, 'altitude': 0}",hd,_3NfEDvdofY
I met the Indigenous Muslims of Poland - Polish Muslims documentary BTS story,2023-06-03T21:00:06Z,86444,3237,1414,"['muslims', 'poland', 'polish', 'tatars', 'history', 'islam', 'allah', 'faith', 'religion']",22,UC1KQMrAkTXCx0oGPWppZKVg,PT7M19S,{},hd,8mqGnsN92L4
"IS POLAND EUROPE? | Stand Up Comedy Crowd Work in Warsaw, Poland | Dragos Comedy",2023-10-26T11:20:52Z,7983,288,33,"['comedy', 'standup', 'comedy comedian', 'stand up comedy europe', 'STAND UP COMEDY', 'STAND UP COMEDIAN', 'CROWD WORK', 'stand up comedy full', 'stand up comedy special', 'Live Audience Interaction', 'Comedy Night', 'Eastern European Humor', 'Slavic Humour', 'Eastern Europe jokes', 'Stand Up comedy crowd work', 'crowd work stand up comedy', 'Stand Up Comedy English', 'Crowd Work English', 'Eastern Europe Stand Up Comedy', 'Slavic Stand Up Comedy', 'stand up comedy Poland', 'crowd word slavic', 'dragos comedy']",23,UCGmFvH5bL4sUerU76Nr2f8A,PT22M46S,{},hd,mYL-oce4oO4
President Biden Addresses Reported Missile Strike In Poland,2022-11-16T04:00:14Z,33822,482,262,"['NBC News NOW', 'NOW Tonight', 'Joshua Johnson']",25,UCeY0bbntWzzVIaj2z3QigXg,PT6M32S,{},hd,RK4moykH6iU
First Time in Gdansk 🇵🇱 Poland’s Baltic Gem!,2022-07-10T15:00:16Z,46370,1509,251,"['gdansk', 'gdansk poland', 'gdansk 4k', 'gdansk nightlife', 'gdansk vlog', 'gdansk pronunciation', 'gdansk poland walking tour', 'gdansk walking tour', 'gdansk poland travel vlog', 'gdansk poland 2022', 'gdansk poland travel video', 'gdansk city tour', 'gdansk city', 'gdansk things to do', 'gdansk tour', 'gdańsk polska', 'visit gdańsk', 'gdańsk things to do', 'what to do in gdansk', 'gdańsk travel', 'gdansk must see', 'gdansk travel guide', 'poland travel guide', 'gdansk poland 4k', 'gdansk poland vlog', 'gdnask', 'poland']",19,UCaghnfCBQmDjkfE6QDUF2aA,PT18M21S,"{'latitude': 54.3520252, 'longitude': 18.6466384, 'altitude': 0}",hd,GFMWCQdvsAg
Will I Find My Dream Home in… Eastern Europe?,2023-11-17T15:00:39Z,466087,21942,2267,"['zakopane', 'carpathian', 'carpathian mountains', 'carpathian poland', 'ochotnica gorna', 'gorce mountains', 'gorna chata', 'gorczanski park narodowy', 'polish mountains', 'poland travel', 'buying property in poland']",19,UCDTINI9skkeZNY2ZXnBqIkQ,PT24M45S,{},hd,kxMZManapqU
Have I experienced any culture shock in Poland?,2023-11-22T19:21:37Z,6450,247,36,[],22,UCL9do86F6OteFbfONXAMM1w,PT11M42S,{},hd,V5pBZVa6-Bk
Warsaw Poland in 8K Video by Drone  | 8K Video of Aerial Warsaw Poland,2022-02-04T14:00:18Z,3685,123,8,"['8k', '8k video', 'warsaw 8k', '8k warsaw', '8k video poland', '8k video warsaw', 'warsaw poland 8k', 'warsaw 8k drone', '8k aerial warsaw', '8k drone footage', 'warsaw 4k', 'warsaw poland 4k', 'warsaw poland travel', 'warsaw poland', 'warszawa 4k', 'warsaw skyline', 'warsaw drone', 'poland drone', 'warsaw by night', 'warsaw drone 4k', 'warsaw 4k night', 'warsaw 8k night', '8k hdr dolby vision', '8k hdr', '8k video ultra hd', 'stress relief', '4k video', 'poland 4k drone', 'warsaw poland drone', '8k aerial', '8k aerial video']",19,UC5pBNl48hhwI0Hm0sPoXEdg,PT10M53S,{},hd,QKvuxjQtMCw
Queen Elizabeth II in Poland (1996),2023-03-23T13:30:10Z,17902,136,5,"['queen elizabeth ii', 'united kingdom', 'royal family', 'british royal family', 'queen elizabeth', 'royal history', 'prince charles', 'królowa elżbieta ii', 'king charles', 'british royals', 'queen elizabeth ii funny moments', 'poland', 'queen in poland', 'queen elizabeth in poland', 'prince charles in poland', 'prince of wales in poland', 'poland nato', 'russia', 'russia ukraine war', 'russia ukraine news', 'russia vs ukraine war update', 'russia vs nato war', 'russia nato war', 'russia nato news', 'russia poland war']",25,UCKmqYReXoCMbVgxaT5XuM4w,PT1M57S,{},hd,XecyZbHZHmY
Preparing for Invasion: Poland's Paramilitary Weekend Warriors,2015-08-12T16:36:44Z,1300941,16450,5793,"['documentary', 'documentaries', 'interview', 'interviews', 'culture', 'wild', 'lifestyle', 'world', 'exclusive', 'independent', 'underground', 'videos', 'funny', 'funny videos', 'journalism', 'vice guide', 'vice presents', 'vice news', 'vbs.tv', 'vice.com', 'vice', 'vice magazine', 'vice mag', 'vice videos', 'Poland', 'Russia', 'Militia', 'Ukraine', 'tension', 'nationalism', 'war', 'invasion', 'unrest', 'military training', 'private armies']",24,UCn8zNIfYAQNdrFRrr8oibKw,PT19M34S,{},hd,yzbCkHxNxvc
Englishman Reacts to... Why did Japan refuse Poland's declaration of war in WW2?,2023-11-06T15:00:30Z,13625,594,162,"['documentaries', 'history documentary', 'documentary', 'poland', 'japan', 'world war 2', 'ww2', 'englishman reacts to poland', 'why did japan refuse polands declaration of war in ww2?', 'history matters reaction', 'simple history reaction', 'history reaction', 'history matters']",24,UCVrkUiSjOmOQ0i9JSI7mawg,PT7M49S,{},hd,bDsCeQO80MY
5 Reasons Poland! 🇵🇱,2023-02-09T14:51:37Z,9138,330,120,"['5 Reasons Poland', 'Poland', 'Warsaw', 'why visit Poland', 'things to do in Poland', 'why travel to Poland', 'Warsaw Poland', 'why visit Warsaw Poland', 'things to do in Warsaw Poland', 'why travel to Warsaw Poland', 'Polish girls', 'dating Poland', 'travel Poland', 'travel Warsaw', 'Krakow', 'Lublin', 'Gdansk', 'Lodz']",19,UCz9WfSs2nuabYM_3LAARWHg,PT9M59S,"{'latitude': 52.2296756, 'longitude': 21.0122287, 'altitude': 0}",hd,3HXycag5Uhg
Kazimierz Dolny - Beautiful Small Town in Poland,2020-06-30T16:37:29Z,2825,88,9,"['chido-fajny', 'mexicanos en polonia', 'mexicano en polonia', 'kazimierz dolny', 'ciudades de polonia', 'turismo en polonia', 'visita polonia', 'visit poland', 'visita kazimierz']",22,UCk8aGSHKBLLpMnX3rsiQ-vA,PT8M32S,{},hd,jPaFL6y6XPk
Exploring ALL of KRAKOW in 72 hours | Poland Travel Guide,2021-12-11T11:00:13Z,16738,320,43,"['exploring all of krakow in 72 hours', 'exploring krakow', 'how to explore krakow', 'krakow guide', 'krakow travel', 'krakow travel vlog', '72 hours in krakow', '3 days in krakow', 'how to travel krakow', 'poland travel guide', 'krakow old town', 'auschwitz', 'visiting auscwitz', 'krakow museums', 'krakow weekend escape', 'poland travel', 'poland travel vlog', 'seraching krakow', 'krakow poland', 'i want to travel krakow', 'exploring all of krakow in 72 house', 'exploring all of krakow in 72 housr']",22,UCYAIbGWcLdohnpRh-YLXzRw,PT13M31S,"{'latitude': 50.0646501, 'longitude': 19.9449799, 'altitude': 0}",hd,O_who0ucpt0
I met the Indigenous Muslims of Poland - Polish Muslims documentary BTS story,2023-06-03T21:00:06Z,86444,3237,1414,"['muslims', 'poland', 'polish', 'tatars', 'history', 'islam', 'allah', 'faith', 'religion']",22,UC1KQMrAkTXCx0oGPWppZKVg,PT7M19S,{},hd,8mqGnsN92L4
Poland welcomes US troops,2017-01-15T15:36:17Z,161180,1299,401,"['CNN', 'News', 'CNN TV', 'CNN Newsroom', 'default']",25,UCupvZG-5ko_eiXAupbDfxWw,PT4M13S,{},hd,gcM0qFWkY0g
Mongol Invasions of Hungary and Poland DOCUMENTARY,2020-02-10T13:59:47Z,1037100,23455,2075,"['mongol empire', 'mongolian empire', 'mongol history', 'kings and generals', 'full documentary', 'documentary film', 'world history', 'decisive battles', 'ain jalut', 'batu', 'subutai', 'japan', 'delhi sultanate', 'mongolian history', 'mamluks', 'baibars', 'hulagu', 'qutuz', 'seljuk', 'crusader', 'ilkhanate', 'nogai', 'poland', 'hungary', 'chaka', 'golden horde', 'mohi', 'legnica', 'middle ages', 'medieval history', 'military history', 'history channel', 'mongol horde', 'batu khan', 'medieval battle', 'history lesson', 'kublai', 'battle of mohi', 'genghis khan']",27,UCMmaBzfCCwZ2KqaBJjkj0fw,PT23M27S,{},hd,699KWqGfl-w
History of Poland in countryballs,2018-07-15T16:00:00Z,1404070,24910,5200,"['poland', 'Polska', 'countryballs', 'animation', 'history of Poland', 'animacja', 'historia Polski', 'countryballe', 'historia Polski w countryballach', 'animacja o historii Polskii', 'animation about History of Poland', 'warsaw poland', 'Warsaw', '966', 'slav', 'slavs history', 'slavic tribes', 'WW2', 'interwar period', 'interwar', 'interwar poland', 'communist poland', 'Rzeczpospolita', 'Rzeczpospolita Obojga Narodów', 'PLC', 'husaria', 'hussars', 'sad', 'epic', 'war', 'sad history', 'nation', 'Napoleon', 'Napoleon Poland', 'Russian occupation Poland']",27,UCx22mlTERBqxg30j186hOsA,PT7M33S,{},hd,Avw3fBxlqoI
Russian missile kills two in Poland: Report,2022-11-15T19:24:11Z,413873,6758,0,"['FNC', 'Fox News', 'Fox News Channel', 'News', 'russia', 'russian missile', 'poland', 'two killed in poland', 'NATO', 'NATO members', 'russian missiles', 'russia hits poland', 'russian missile hits poland', 'russia attacks poland', 'russia attacked poland', 'russia bombing poland', 'did russia bomb poland', 'nato countries', 'poland attack', 'russia bomb poland', 'poland bomb', 'is poland nato', 'poland attacked', 'poland attacked by russia', 'poland bombing', 'is poland in nato', 'russia attacks nato', 'did russia attack nato']",25,UCXIJgqnII2ZOINSWNOGFThA,PT4M34S,{},hd,3rUrrSlEwrg
Second Life Destinations - Poland History House,2023-04-11T15:56:57Z,2409,132,39,"['Second Life', 'secondlife', 'virtual world', 'avatar', 'virtual worlds', 'game', 'gaming', 'virtual reality', 'tutorials', 'gameplay', 'linden lab', 'lindenlab', 'linden lab second life', 'virtualworld', 'virtualworlds', 'second life gameplay', 'metaverse', 'Draxtor Despres', 'Poland History House', 'second life destinations', 'destination guide', 'second life destination guide', 'visit poland', 'Poland', 'Poland’s Independence', 'second life 2023']",20,UC5dsLkNZX9pVgmEHpJX9QCA,PT2M50S,{},hd,ruLYK6sHYlw
Krakow Poland Nativity Scenes Competition 2022 | Szopka Krakowska Christmas Tradition In Krakow,2022-12-01T18:56:34Z,10549,322,48,"['kraków nativity scenes contest', 'adam mickiewicz monument', 'christmas in krakow', 'christmas in poland', 'christmas traditions in krakow', 'christmas traditions in poland', 'first thursday of december', 'historical museum of kraków', 'krakow in december', 'krakow nativity scene', 'krakow poland nativity competition', 'krakow poland nativity contest', 'krakow poland nativity scene', 'krakow szopka', 'kraków szopka', 'main square krakow poland', 'polish christmas traditions', 'szopka', 'things to do in krakow']",19,UCL9QCO5vimeOw2VLh3xdWQw,PT33M57S,"{'latitude': 50.0646501, 'longitude': 19.9449799, 'altitude': 0}",hd,ekbZygMy2Gk
MAJONEZ AND KIELBASA PARTY - Poland country review,2016-07-31T21:30:43Z,4494049,161019,19667,"['Poland', 'tourism', 'review', 'life of boris', 'boris', 'slav', 'slavic', 'majonez', 'kielbasa', 'slavic country', 'polish sausage', 'country review', 'boris poland', 'boris country review', 'poland country review', 'travel', 'russian accent']",23,UCS5tt2z_DFvG7-39J3aE-bQ,PT10M25S,{},hd,4DxOdT2JHjc
Poland Travel Video (What to do in POLAND),2019-11-19T12:36:47Z,5947,154,40,"['Poland Travel Video (What to do in POLAND)', 'poland travel vlog', 'warsaw poland travel', 'poland', ""poland's best cities"", 'gdańsk poland', 'Kołobrzeg poland', 'kraków poland', 'Manowo poland', 'polish travel guide', 'poznań poland', 'sopot poland', 'Things to do in poland', 'Things you need to know before coming to Poland', 'visit poland', 'warsaw poland', 'wrocław poland', 'zakopane poland', 'olivia gudaniec', 'poland travel', 'poland travel guide']",19,UCgAcckCB1hgzNCjsHHS0Q8g,PT16M20S,"{'latitude': 51.919438, 'longitude': 19.145136, 'altitude': 0}",hd,T5ackLUdnYk
Poland Day Trip | Swiebodzin | Travel Western Poland | Jesus Statue | Christ the King statue,2022-10-12T17:53:47Z,731,28,7,"['swiebodzin', 'poland', 'western', 'day', 'trip', 'travel', 'polish', 'polska', 'christ', 'the', 'king', 'statue', 'christ the king statue', 'christ the redeemer', 'rio de janeiro', 'Jesus statue', 'large statue', 'pilgramage', 'market square', 'middle ages', 'poznan']",19,UCGM-7YmTv_UUWm3wfzxYGbg,PT4M38S,"{'latitude': 52.2472962, 'longitude': 15.5335721, 'altitude': 0}",hd,SclAy8OjdzA
These Are 5 (More) Things THAT SURPRISED ME IN POLAND,2020-06-30T14:25:25Z,539150,23773,1403,[],22,UCAlZsyC0HuGx7AZI54edKzg,PT10M27S,"{'latitude': 51.5073509, 'longitude': -0.1277583, 'altitude': 0}",hd,7J7s7C4CMVw
President Biden Addresses Reported Missile Strike In Poland,2022-11-16T04:00:14Z,33822,482,262,"['NBC News NOW', 'NOW Tonight', 'Joshua Johnson']",25,UCeY0bbntWzzVIaj2z3QigXg,PT6M32S,{},hd,RK4moykH6iU
Melania addresses crowd in Poland,2017-07-06T12:02:26Z,100666,376,214,"['CNN', 'News', 'CNN TV', 'CNN Newsroom', 'New Day', 'default']",25,UCupvZG-5ko_eiXAupbDfxWw,PT2M13S,{},hd,FpMmhiYF_q4
Greeks in Poland - Episode 1!!! (POZNAN),2018-07-07T07:00:06Z,11368,217,23,"['poznan', 'ποζναν', 'πολωνια', 'poland', 'europe', 'Poznan Cathedral of St. Peter and Paul', 'Malta Lake', 'Old Market Square', 'καθεδρικος ναος πετρου και παυλου', 'λιμνη μαλτα', 'ευρωπη', 'παρεα', 'διακοπες', 'roadtrip', 'company', 'traveler', 'travel', 'traveling', 'gopro hero 6', 'funny', 'βαρτα', 'warta', 'σταρι ρινεκ', 'stary rynek', 'travel vlog', 'krakow poland', 'greeks in poland']",19,UC88lJ2-SpuDIjwg_K5_n2Zg,PT7M2S,{},sd,r9nE0fOFFdk
Lublin. Kaplica Zamkowa Trójcy Świętej. Lubelskie. Polska. Poland.,2023-11-26T17:00:20Z,103,28,63,"['#drogi', '#travel', '#podróże', '#nature', '#photo', '#traveling', '#phototravel', '#beautiful', '#vacation', '#adventure', '#tourist', '#vlog', '#ścieżka', '#kręte_ścieżki', '#rzeka', '#zdjęcia', '#miasto', '#wieś', '#Polska', '#Poland', '#województwo', '#wakacje', '#morze', '#cerkiew', '#punkt_widokowy', '#zamek', '#muzeum', '#wieża', '#Wielkopolskie', '#Kujawsko_pomorskie', '#Małopolskie', '#Łódzkie', '#Dolnośląskie', '#Lubelskie', '#Lubuskie', '#Mazowieckie', '#Opolskie', '#Podlaskie', '#Pomorskie', '#Śląskie', '#Podkarpackie', '#Świętokrzyskie', '#Warmińsko_Mazurskie', '#Zachodniopomorskie', '#kretesciezkipawelszulc1960']",19,UC4LkiKipqtqOIYOvKzHdFoQ,PT15M23S,"{'latitude': 51.2502648, 'longitude': 22.5731226, 'altitude': 0}",hd,Sxc5Y1kE9kw
POLAND VS INDONESIA,2023-05-28T10:00:09Z,4059,148,2,"['globeinthehat', 'Globe in the Hat', 'Globus w kapeluszu', 'Ania Tomczak', 'bule Polandia', 'Polandia Indonesia', 'Bule Indonesia', 'bule tiktok indonesia', 'Polka w Indonezji', 'Polacy za granicą', 'bule bahasa indonesia', 'polacy w indonezji', 'bahasa polandia', 'polandia indonesia', 'polska indonezja', 'cultural differences between asian and western', 'asian and western culture differences', 'cultural differences funny', 'comedy indonesia', 'comedy', 'różnice kulturowe', 'cultural differences poland indonesia']",24,UCZkVPUf-4-HjaTdrswApBFQ,PT19S,"{'latitude': -0.789275, 'longitude': 113.921327, 'altitude': 0}",hd,FWLgLglWQDc
Tea in Poland | Podcast,2022-10-13T09:39:16Z,468,46,3,[],27,UCM1vdTt_oFZw5rD0wCLC4dA,PT15M7S,{},hd,ZQSS9FCPOac
Easter in Poland: what do I have in my Easter basket?,2022-04-16T11:48:36Z,3820,102,5,[],27,UCM1vdTt_oFZw5rD0wCLC4dA,PT43S,{},hd,Ur2jwN6WyiA
Kazimierz Dolny - Beautiful Small Town in Poland,2020-06-30T16:37:29Z,2825,88,9,"['chido-fajny', 'mexicanos en polonia', 'mexicano en polonia', 'kazimierz dolny', 'ciudades de polonia', 'turismo en polonia', 'visita polonia', 'visit poland', 'visita kazimierz']",22,UCk8aGSHKBLLpMnX3rsiQ-vA,PT8M32S,{},hd,jPaFL6y6XPk
Pierogi is Life in Poland.. (Polish Food & Baltic Beaches),2022-07-12T17:33:29Z,18629,1190,78,"['poland', 'polska', 'Ustronie morskie', 'polish pierogi', 'pierogi', 'polish food', 'abandoned places', 'abandoned bunker', 'poland motorcycle trip', 'poland motorcycle', 'baltic sea', 'poland baltic sea beaches', 'beach poland', 'motorcycle life', 'motorcycle lifestyle', 'honda motorcycle', 'honda transalp', 'motorcycle travel', 'solo ride', 'solo riding motorcycle', 'motorcycle exploring', 'solo traveler', 'enduro motorcycle', 'motorcycle', 'motovlogger', 'adv rider', 'pedro mota']",27,UCQc2abzqbqrp-TZG3K79Wng,PT9M1S,{},hd,qQak4UkSYy0
Poland's role in the Russia-Ukraine war is ‘absolutely crucial’: Polish ambassador,2023-02-04T19:00:31Z,76444,1094,1043,"['war in ukraine', 'ukraine news', 'poland ukraine', 'russia war', 'ukraine war news', 'ukraine war', 'ukraine russia news', 'russia ukraine war', 'ukraine news today latest', 'ukraine news today', 'ukraine news live', 'ukraine news live today', 'ukraine war update', 'ukraine war video footage', 'ukraine war news today', 'fox news', 'fox news media', 'fox news channel', 'fox news today', 'russia ukraine war today']",25,UCXIJgqnII2ZOINSWNOGFThA,PT4M40S,{},hd,nEpnqRO1wwM
Former CIA operative not surprised by Russian spies in Poland  | NewsNation Prime,2022-03-24T00:36:47Z,23352,455,70,"['video', 'Prime', 'news', 'Ukraine', 'Russia', 'Poland', 'America', 'Vladimir Putin', 'Joe Biden', 'Volodymyr Zelenskyy', 'CIA', 'Spies']",25,UCCjG8NtOig0USdrT5D1FpxQ,PT5M9S,{},hd,x1cBJLJS0HQ
Krakow Poland Travel Guide: Best Things To Do in Krakow,2022-07-24T21:43:49Z,14093,359,55,"['Krakow', 'Krakow Poland', 'Poland', 'Krakow travel guide', 'Krakow Expedia', 'Krakow tour', 'Krakow sightseeing', 'Krakow things to do', 'Krakow travel', 'Krakow vacation', 'Best things to do in Krakow', 'Tour', 'Travel', 'Krakow vlog', 'Krakow video']",19,UCarSZcFQ6-0eqZrAG4pKoMA,PT28M57S,"{'latitude': 51.919438, 'longitude': 19.145136, 'altitude': 0}",hd,zHx15Cgnhho
WE WENT TO A VODKA BAR IN KRAKOW POLAND 🇵🇱 WE HIT 1000 SUBSCRIBERS!,2021-12-11T10:00:01Z,50323,1299,225,"['Vodka bar', 'Vodka bar in Krakow', 'Kraków travel covid 2021', 'Krakow', 'Krakow travel vlog', 'Poland travel vlog', 'Poland travel video', 'Poland', 'polish food', 'Poland food tour', 'Poland travel guide', 'things to do in Poland', 'Poland safe', 'Poland worth visiting', 'Poland 2021', 'Zakopane travel 2021', 'Poland travel restrictions', 'Zakopane', 'Zakopane travel vlog', 'krakow 2021', 'krakow poland', 'polish vodka', 'poland vlog', 'poland travel', 'krakow vlog', 'krakow nightlife', 'poland krakow', 'visiting poland']",19,UCdJAmuo-KkgcJvSoQjPxAWg,PT12M29S,"{'latitude': 50.0646501, 'longitude': 19.9449799, 'altitude': 0}",hd,0zDXTBYOVZ4
"Our Trip to Mazury, Poland |The Snowiest Christmas of My Life | საშობაო მოგზაურობა პოლონეთში |Vlog 2",2022-01-19T16:20:10Z,299,17,3,"['zakopane', 'zakopane travel 2020', 'polish tatras', 'tatra mountains', 'couple travel vlog', 'international couple', 'geo-polish couple', 'couple lifestyle', 'couple travel adventures', 'travel in poland']",22,UC4p0nqsrQIRRymfX9AwAiUA,PT6M37S,"{'latitude': 53.5494905, 'longitude': 20.4528371, 'altitude': 0}",hd,5YwQeTz7DDo
Work permit - Business in Poland,2019-09-25T20:25:19Z,4389,501,3,"['Work permit in Poland', 'Live in Poland', 'Business in Poland', 'Company in Poland', 'Polish business', 'Doing business in Poland', 'Entrepreneur in Poland', 'Polish accounting']",27,UCaMRVgk2xImJ0apXljE5Zqw,PT1M19S,{},hd,8IP5xP3IlAo
Englishman Reacts to... Polish Kabaret - Ani Mru Mru - Supermarket,2023-11-24T14:49:26Z,17650,1301,109,"['kabaret', 'amm', 'ani mru mru', 'supermarket', 'poland', 'polish', 'polish comedy', 'polish amm', 'polish kabaret', 'englishman reacts to poland', 'reaction to poland', 'rob reacts', 'rob reacts to poland', 'funny', 'comedy', 'kabarety', 'reaction video', 'funny poland', 'reaction to polish comedy']",23,UCVrkUiSjOmOQ0i9JSI7mawg,PT11M3S,{},hd,XtpcAoQyFqM
Equinix Recruitment Video Poland,2023-11-27T09:39:06Z,52,0,0,[],28,UC9xshmMk-FKjqKCLOKklQQw,PT1M49S,{},hd,G4wVLAcWbcw
